item-name	item-description	listing-id	seller-sku	price	quantity	open-date	image-url	item-is-marketplace	product-id-type	zshop-shipping-fee	item-note	item-condition	zshop-category1	zshop-browse-path	zshop-storefront-feature	asin1	asin2	asin3	will-ship-internationally	expedited-shipping	zshop-boldface	product-id	bid-for-featured-placement	add-delete	pending-quantity	fulfillment-channel	merchant-shipping-group	status
Seculife Seculife Mini GPS Tracker for Vehicles Cars Trucks RVs USA Based Company. Real Time 5G 4G LTE Car GPS Tracking Device Long Lasting Battery. Worldwide Unlimited Distance. Subscription Needed	<b>Why SecuLife is a great choice?</b><br><br> Prevent theft, loss & know where your precious things are. Monthly fee is required (fee details can be found elsewhere on this listing). Our trackers are used by asset & business owners and many more. Lost, stolen or damaged device insurance included. Revolutionary 5G, 4G LTE, 3G & 2G combined, works everywhere with any network old or new for best coverage. The SecuLife device is small and light as you can find and therefore contains a small rechargeable battery that usually lasts 3-10 days in real-time tracking in battery save mode.<br><br> Track in real-time on your smartphone with our state-of-the-art smart phone App, with full reporting, alerts + screen navigation size & color customization + Real-time tracking on the map and panoramic Google map. <br><br> Use it as anti-theft and pinpoint recovery of anything lost. Alerts: speeding, start moving, enter/leave Geo-fence & low battery. Place in a car, backpack, luggage, shipment or under a car with the available strong magnetic case attachment. Unlimited distance real time infinite range tracking in USA. International SIM card is embedded inside the tracker, plans available for 200 countries. Easy setup works out-of-the-box. 2 tracking modes GPS for outdoors & indoors. <br><br> Just like a cellphone your tracker needs a paid data connection using the cellular network for unlimited distance tracking worldwide. Monthly subscription fee is required for the device's internet connectivity + the use of our vast USA Based servers platform, R&D and live nonstop system maintenance. <br><br> <b>For us, ‘Customer is King’, we will always go the extra mile. Compatible with Android, iPhone, Google maps, Alexa and Google Assistant.</b>	0403BCLNB4C	A-SL-JM-TRLL1AS	29	0	2024-04-03 16:47:40 PDT		y	3			11				B0CZSJBNL5						850047633958			0	DEFAULT	Migrated Template	Inactive
Seculife GPS Tracker for Kids Real-Time Tracking Device with SOS Button & 2-Way Speakerphone - Safety Electronics for Kids, Special Needs, Autism (Blue Smartwatch)	SecuLife smartwatch is equipped with Google Maps that offers parents with precise real-time tracking and historical route review. Parents can feel at ease with our GPS Location Tracking kid's watches, along with the ability to make SOS calls to family and caregivers listed in the app. Parents will receive alerts when these emergency calls are made with location updates, plus the ability to block unknown calls.	1006BHVINGJ	A-SL-KDBLU25	59.99	0	2024-10-06 09:09:35 PDT		y	3			11				B0DJL4ZZDQ						860012929207			0	DEFAULT	Migrated Template	Inactive
SecuLife SecuLife Vehicles Car Truck GPS Tracker - $9 Monthly 4G LTE GPS Real Time Location Tracker - OBD Automotive - Just Plug & Track	GPS tracking is a feature that most business drivers take for granted. It’s the ability to track the location of some or all of your fleet of vehicles at any given time and it’s a feature that some companies and individuals feel is necessary in today’s world. Take charge of your business’s most valued asset, its fleet of vehicles. OBD Vehicle Tracking enables you to monitor the location of your fleet at any given time, no matter where you are. With SecuLife OBD vehicle tracking device and mobile app software, you can: Track your vehicles location in real time Monitor speeds and driver behavior especially in teens and new drivers, rental car units, fleets, and loaner vehicles on apps like Turo Get alerts when a vehicle leaves its dedicated location set up by you in our mobile app Create geofencing perimeters to track when vehicles enter or leave a specified location With SecuLife’s OBD Vehicle Tracking, you have an easy-to-use GPS tracking solution that integrates with your car to provide tracking when there’s no signal. Whether it’s in a dead zone or just in a pocket, OBD Vehicle Tracking will pick up the signal when the car moves and use the OBD port to transmit current location coordinates to a customer account in real time. OBD Vehicle Tracking is a low cost and easy-to-use vehicle tracking system that helps you manage and find lost and stolen vehicles, and monitor fleet vehicles. We are USA based company focused on personal Safety & GPS tracking innovation. Seculife software is developed & made by us. We are not just a white label resellers. We provide worldwide services to many top companies and individuals.	0408ZMWM7NL	A-SL-OBD	30	0	2022-04-08 09:40:20 PDT		y	3			11				B09XJ9YNLV						850021014568			0	DEFAULT	Migrated Template	Inactive
SecuLife SecuLife OBD GPS Tracker for Vehicles - $6 Monthly 5G 4G LTE GPS Tracking Device - Real Time Location Tracker - OBD Automotive, Car, Truck Tracking Devices - Just Plug & Drive	???? ????????????: The small and compact gps tracker of Seculife is relatively easy to install. All you need to do is plug-in GPS into the OBD port under the steering column. You do not need any battery for installation as the OBD port powers it. ????-???? ????????: The OBD tracking devices provide a real-time tracking service and is ideal for small and medium-sized businesses with less than 20 vehicles to manage. You can track Fleet automobiles, personal vehicles, cars, trucks, teenage, elderly drivers, and rental car units. ???????? ??????????: Geofencing notifies you through the app whenever your vehicle enters or exits an assigned location. The location tracker lets you track your vehicle, fleets, and other OBD Port Capable transpiration methods. ??-??-?????? ??????: SecuLife’s OBD GPS tracking device provides up-to-minute alerts of any current location details. It also gives you the option to review your historical route data. ?????????? ????????: The SecuLife OBD GPS tracker device uses 4G/LTE/CAT M/NB IoT network technology, providing coverage throughout North America. Moreover, you can use the device in the USA, Canada, and Mexico. ??????? ???????: We are an eco-conscious company concerned about saving the trees, therefore the product user manuals will be emailed at the time of activation and are also available for download on the SecuLife site.	1111ZXO161T	A-SL-OBD-AT	39	0	2022-11-11 11:57:51 PST		y	1			11				B0BM569D9T						B0BM569D9T			0	DEFAULT	Migrated Template	Inactive
SecuLife OBD GPS Tracker for Vehicles - 5G 4G LTE GPS Tracking Device - OBD Automotive Location Tracking Device - 1 Year of Worldwide Tracking Service Included - Just Plug & Drive	??? ???????? ???????: The OBD tracking device provides 1 year of GPS tracking service and is ideal for small and medium-sized businesses with less than 20 vehicles to manage. You can track Fleet automobiles, personal vehicles, cars, trucks, teenage, elderly drivers, and rental car units. Track any car, truck, van, motorcycle or RV on the road to keep tabs while in use or in storage. ???? ????????????: The small and compact gps tracker is relatively easy to install. All you need to do is plug-in GPS into the OBD port under the steering column. Never worry about charging a battery, as the OBD port powers it automatically. ???????? ??????????: Geofencing notifies you through the app whenever your vehicle enters or exits an assigned location. Create geo-fence zones of any shape, not just simple circular zones. ??-??-?????? ??????: When your GPS tracker moves into an area of interest or gets away from the original location, You will be immediately notified via Text/SMS, email and in app notification. Receive engine on/off alerts, over speed alerts and more. Includes 1 year of historical reports. The SecuLife app is compatible with all Apple IOS, Windows, and Android smartphones. ????????? ????????: SeculIfe's location tracker uses 5G/4G/LTE/ CAT-M, NB IoT service. GPS Tracking works in over 200 countries, plus the USA, Canada and Mexico. ??????? ???????: We are an eco-conscious company concerned about saving the trees, therefore the product user manuals will be emailed at the time of activation and are also available for download on the SecuLife site. ?? ????? ???????: Seculife offers live customer support available 7 days a week to guide you in your activation process and answer any questions you may have. We provide a personal onboarding call and a lifetime device warranty.	1104ZFKSVGH	A-SL-OBD-T	150	0	2022-11-04 13:41:46 PDT		y	3			11				B0BLJ461ZX						850021014995			0	DEFAULT	Migrated Template	Inactive
SecuLife GPS OBD Vehicle and Personal Trackers for use with People, Property, Cars, Trucks, Vans, Boats, and More (OBD Vehicle Tracker)	AFFORDABLE OBD VEHICLE TRACKER: Always know where your vehicles are with the Seculife OBD plug-in tracker. Our plans are AFFORDABLE starting at just $8.00 a month! Designed for small & medium sized businesses that have less than 20 vehicles to manage. It is the perfect device to track FLEET AUTOMOBILES, PERSONAL VEHICLES, CARS, TRUCKS, TEENAGE & ELDERLY DRIVERS, and RENTAL CAR UNITS. Ideal for car sharing marketplaces like Turo, Zipcar, Car2go, Get Around, etc. RELIABLE GPS TRACKING: OBD Vehicle Tracker uses a secured 5G / 4G / LTE / CAT M / NB IoT cellular network. The REAL-TIME GPS OBD Vehicle Tracker will pick up the signal when the car moves and use the OBD port to transmit current location coordinates to a customer account. Device works in the USA CANADA AND MEXICO. EASY INSTALLATION: It takes less than a minute to install, activate and start tracking! Our OBD plug-in GPS tracker easily snaps into the OBDII port. (typically found under the steering column in most vehicles) A smart tracking device with EASY PLUG & DRIVE INSTALLATION. No Battery needed, powered by the OBD port. SIMPLE-TO-USE APP: Our software is fully customizable, decide what ALERTS & NOTIFICATIONS you want and how to get them (Push, Email & SMS). The app works on Apple IOS, Android, or Windows. Easily sync to the app to monitor and track up to 20 vehicles at once from a phone, desktop, laptop or tablet. Create GEOFENCING PERIMETERS to track in real time when vehicles enter or leave a location making it easy to FIND LOST & STOLEN VEHICLES. Receive an alert if the tracker has been TAMPERED with. CUSTOMER SERVICE & LIFETIME WARRANTY: Seculife OBD Vehicle GPS Tracker offers U.S. Based LIVE CUSTOMER SUPPORT AVAILABLE 7 DAYS A WEEK to guide you in your SecuLife activation process and answer any questions you may have. Includes a LIFETIME DEVICE WARRANTY.	0726ZHZ50H2	A-SL-OBDJM	39	0	2022-07-26 11:48:04 PDT		y	3			11				B0B7KLQL7Z						850021014841			0	DEFAULT	Migrated Template	Inactive
SecuLife GPS Tracking Solution-OBD Vehicle Tracker | Real-Time GPS Tracking for Vehicles, Teen Drivers, Seniors (OBD Vehicle Tracker)	AFFORDABLE TRACKERS: It’s never lost if you have a Seculife personal monitoring system. Designed for personal use, it tracks your LOVED ONES, CARS, MOTORCYCLES, BOATS, ATV, BICYCLES, LUGGAGE, BACKPACKS, SHIPMENTS and other valuable property. Our plans are AFFORDABLE starting at just $8.00 a month! SIMPLE TO USE - select your ideal tracker, activate the device, choose your plan, and start tracking. Perfect for vehicles, teen drivers, kids, employees, partners, seniors and more. RELIABLE GPS TRACKING: Seculife Personal GPS Tracker uses a secured IoT 5G 4G LTE network to provide REAL-TIME TRACKING. The system is designed with four components that function together to allow you to find or locate what you are looking for in seconds. Expanded tracking capabilities work in the USA, CANADA, AND MEXICO. With more than a 99.99% uptime, our cloud-based technology gives you the data you want, when you want it. EASY-TO-USE SOFTWARE & FEATURES: It only takes 5 minutes to activate, install, and start tracking! Our intuitive software is fully customizable, create GEOFENCING PERIMETERS, decide what ALERTS & NOTIFICATIONS you want and how to get them (Push, Email & SMS). Record LOCATION HISTORY for up to 1 year. The Seculife app will work on IOS, Android, or Windows. Easily sync to the app to monitor and track your loved ones and assets from a phone, desktop, laptop or tablet. EMERGENCY ALERT BUTTON: If you select the Seculife GL Series (GL300 | GL310 | GL320) GPS Tracker or the Adult SOS Wristband they come with a user-friendly SOS PANIC BUTTON for Personal SAFETY MANAGEMENT and Asset Monitoring Applications. The SecuLife Personal Asset Tracker can provide peace of mind knowing that you will be immediately notified in the event of an emergency. SMALL, DISCRETE & POWERFUL: The GL Series tracker is ONLY 1" (1 inch) THICK. The tracker is small enough to HIDE IN ALMOST ANYTHING, including glove boxes, bags, suitcases, and briefcases.	0607ZL871AB	A-SL-OBDJM-Var	39	0	2022-06-07 11:00:12 PDT		y	3			11				B0B3FRQBZC						850021014728			0	DEFAULT	Migrated Template	Inactive
SOS GPS Wristband Bracelet and Tracker with Emergency Alert Button and 2 Way Calling (SOS Wristband Black Button)	*AFFORDABLE SAFETY MONITOR: Featuring an Easy-to-See Red Button the SOS Wristband is the perfect solution to keep your loved ones safe. Our Plans start at only $14.99 a month! SecuLife's SIMPLE TO USE safety alert wristband provides an INNOVATIVE way to monitor your loved ones location anytime, from anywhere. Our SOS wristband was designed to be used for people with AUTISM, SPECIAL NEEDS, PARKINSONS, ALZEIHMERS & DEMENTIA. *RELIABLE GPS TRACKING: The tracker provides continuous all-day monitoring with a secured IoT 5G 4G LTE cellular network. Expanded GPS TRACKING capabilities work in the USA, Canada, and Mexico for the most accurate location possible. Know immediately if your loved one is lost and find them ASAP! Special details include unlimited LIVE REAL-TIME TRACKING, Customizable GEOFENCE SAFETY AREAS, Detailed Location History, & More.*EASY-TO-USE SOFTWARE & FEATURES: It only takes 5 minutes to activate, install, and start tracking! The Seculife app will work on IOS, Android, or Windows. Our intuitive software is FULLY CUSTOMIZABLE, add contacts & SET PERMISSIONS, turn on & off features, decide what ALERTS & NOTIFICATIONS you want and how to get them (Push, Email & SMS). Easily sync to the Seculife app to monitor and track your loved ones from a phone, desktop, laptop or tablet.*EMERGENCY ALERT & 2 WAY CALLING: When there is an emergency, push and hold the Red SOS BUTTON, and it will immediately alert your contacts. The emergency contacts will be sent your location details, and they can review it with the real-time tracking system. The wristband also features TWO WAY CALLING CAPABILITIES, and is easy to use. Talk to your loved one or LISTEN-IN REMOTELY. Includes VOICE ASSISTIVE SPEAKERPHONE and AUTO-ANSWER to help people who are physically impaired answer your call.*SMALL & LIGHTWEIGHT: The COMPACT SIZE and COMFORTABLE FIT will allow you to stay safe and connected without anything heavy weighing you down or sacrificing your dignity to bulky trackers.	0726ZI22DZ5	A-SL-SOS-BLK	99.99	0	2022-07-26 13:14:25 PDT		y	3			11				B0B7KLJHK3						850021014858			0	DEFAULT	Migrated Template	Inactive
SOS GPS Wristband Bracelet and Tracker with Emergency Alert Button and 2 Way Calling (SOS Wristband Red Button)	*AFFORDABLE SAFETY MONITOR: Featuring an Easy-to-See Red Button the SOS Wristband is the perfect solution to keep your loved ones safe. Our Plans start at only $14.99 a month! SecuLife's SIMPLE TO USE safety alert wristband provides an INNOVATIVE way to monitor your loved ones location anytime, from anywhere. Our SOS wristband was designed to be used for people with AUTISM, SPECIAL NEEDS, PARKINSONS, ALZEIHMERS & DEMENTIA. *RELIABLE GPS TRACKING: The tracker provides continuous all-day monitoring with a secured IoT 5G 4G LTE cellular network. Expanded GPS TRACKING capabilities work in the USA, Canada, and Mexico for the most accurate location possible. Know immediately if your loved one is lost and find them ASAP! Special details include unlimited LIVE REAL-TIME TRACKING, Customizable GEOFENCE SAFETY AREAS, Detailed Location History, & More.*EASY-TO-USE SOFTWARE & FEATURES: It only takes 5 minutes to activate, install, and start tracking! The Seculife app will work on IOS, Android, or Windows. Our intuitive software is FULLY CUSTOMIZABLE, add contacts & SET PERMISSIONS, turn on & off features, decide what ALERTS & NOTIFICATIONS you want and how to get them (Push, Email & SMS). Easily sync to the Seculife app to monitor and track your loved ones from a phone, desktop, laptop or tablet.*EMERGENCY ALERT & 2 WAY CALLING: When there is an emergency, push and hold the Red SOS BUTTON, and it will immediately alert your contacts. The emergency contacts will be sent your location details, and they can review it with the real-time tracking system. The wristband also features TWO WAY CALLING CAPABILITIES, and is easy to use. Talk to your loved one or LISTEN-IN REMOTELY. Includes VOICE ASSISTIVE SPEAKERPHONE and AUTO-ANSWER to help people who are physically impaired answer your call.*SMALL & LIGHTWEIGHT: The COMPACT SIZE and COMFORTABLE FIT will allow you to stay safe and connected without anything heavy weighing you down or sacrificing your dignity to bulky trackers.	0726ZI4D7VQ	A-SL-SOS-RED	99.99	0	2022-07-26 13:14:25 PDT		y	3			11				B0B7KNX3SR						850021014865			0	DEFAULT	Migrated Template	Inactive
SOS Smartwatch for Seniors - Gps Bracelet for Elderly Health Monitoring Medical Alert Systems for Seniors with Speaker, Medical Alert System,GPS Tracker 5G 4G LTE Cellular Service, Life Alert Necklace	<b>Empowering Safety Solutions for Adults, Seniors, and Individuals with Special Needs.</b> <br><br>In critical moments, relying solely on a cellphone or landline might not suffice for ensuring safety and security. Accessing a phone during an emergency can be extremely challenging. However, with the SecuLife SOS Smartwatch's advanced features including two-way calling and automatic SOS dialing, help can be summoned swiftly! Equipped with a pre-installed 4G LTE sim card, this smartwatch offers top-notch call clarity, precise location tracking, and rapid response times. It allows you to instantly communicate with your loved ones, even if they are unable to answer the call. The integrated speaker and microphone facilitate seamless two-way communication in case of emergencies. <br><br>Download our EASY-TO-USE App for Access to All Essential Features: Real-Time Tracking, Historical GPS Locations, Unlimited Geofencing Areas. Customizable Notifications Mobile Push Notifications Delivered to Your Mobile App, Email, and SMS/Text. <br><br>Battery Life: Up to 12 hours battery life when set to 1 minute tracking intervals. <br><br>Support Available 7-Days a Week: Operators are available via phone, chat, and email. <br><br>Free Upgrades: New and Free Equipment Provided When you Need to Upgrade. <br><br>Your Satisfaction Is Important: We want you to be delighted with your purchase so we allow a 7 day return window. An activated plan is required to use the device, and plans can be reimbursed within the 7 day period after activation. Returns will not apply for plans that have been activated for more than 7 days.	1023A5IZDML	A-SL-SOS-SWSr	54.99	0	2023-10-23 12:27:25 PDT		y	3			11				B0CLMDVZR3						850047633514			0	DEFAULT	Migrated Template	Inactive
Seculife SOS Wristband - Personal Safety GPS Tracker for Dementia, Alzeihmers, Seniors, Elderly, Adults, Special Needs - SOS Button - 2 Way Calling - in App Tracking - IP67 Water Resistant	A new, next-level, and easy way to stay protected and connected – anytime, anywhere! Give yourself and the ones you love a peace of mind regarding your day-to-day whereabouts and personal safety with reliable, smart technology, such as proactive alerts and live GPS location using a nationwide, fast 4G LTE network. Know you’re in good hands and help is at your fingertips! Track your loved one’s location in real-time and access remote location history information on the go with our secure mobile app. SecuLife's safety alert wristband, personal safety, and asset tracking devices provide an innovative way to monitor loved ones, personal effects, or business assets anytime, from anywhere, giving you the peace of mind and confidence you deserve. Track your loved one’s location in real-time and access remote location history information on the go with our secure mobile app. SecuLife's safety alert wristband, personal safety, and asset tracking devices provide an innovative way to monitor loved ones, personal effects, or business assets anytime, from anywhere, giving you the peace of mind and confidence you deserve. RELIABLE GPS TRACKING: SecuLife's safety alert wristband tracking device provides an innovative way to monitor loved ones anytime, from anywhere, giving you the peace of mind and confidence you deserve. Track your loved one’s location in real-time and access remote location history information on the go with our secure mobile app. EASY-TO-USE SOFTWARE & FEATURES: It only takes 5 minutes to activate, install, and start tracking! Our intuitive software features real time alerts based on the entry and exit zones you specify in the SecuLife app. Easily sync to your mobile app to monitor and track your loved ones location anytime, from anywhere. EMERGENCY ALERT BUTTON: When there is an emergency, push and hold the SOS button, and it will immediately alert your contacts. The emergency contacts will be sent your location details, and they can monitor your location	0531Z8X9SM0	A-SL-SOSBLK	99.99	0	2022-05-31 10:47:33 PDT		y	3			11				B0B2TCZKR9						850021014698			0	DEFAULT	Migrated Template	Inactive
SecuLife GPS Tracking Solution-Adult SOS GPS Wristband | Real-Time GPS Tracking for People, Elderly, Seniors (Black Button SOS Wristband)	AFFORDABLE TRACKERS: It’s never lost if you have a Seculife personal monitoring system. Designed for personal use, it tracks your LOVED ONES, CARS, MOTORCYCLES, BOATS, ATV, BICYCLES, LUGGAGE, BACKPACKS, SHIPMENTS and other valuable property. Our plans are AFFORDABLE starting at just $8.00 a month! SIMPLE TO USE - select your ideal tracker, activate the device, choose your plan, and start tracking. Perfect for vehicles, teen drivers, kids, employees, partners, seniors and more. RELIABLE GPS TRACKING: Seculife Personal GPS Tracker uses a secured IoT 5G 4G LTE network to provide REAL-TIME TRACKING. The system is designed with four components that function together to allow you to find or locate what you are looking for in seconds. Expanded tracking capabilities work in the USA, CANADA, AND MEXICO. With more than a 99.99% uptime, our cloud-based technology gives you the data you want, when you want it. EASY-TO-USE SOFTWARE & FEATURES: It only takes 5 minutes to activate, install, and start tracking! Our intuitive software is fully customizable, create GEOFENCING PERIMETERS, decide what ALERTS & NOTIFICATIONS you want and how to get them (Push, Email & SMS). Record LOCATION HISTORY for up to 1 year. The Seculife app will work on IOS, Android, or Windows. Easily sync to the app to monitor and track your loved ones and assets from a phone, desktop, laptop or tablet. EMERGENCY ALERT BUTTON: If you select the Seculife GL Series (GL300 | GL310 | GL320) GPS Tracker or the Adult SOS Wristband they come with a user-friendly SOS PANIC BUTTON for Personal SAFETY MANAGEMENT and Asset Monitoring Applications. The SecuLife Personal Asset Tracker can provide peace of mind knowing that you will be immediately notified in the event of an emergency. SMALL, DISCRETE & POWERFUL: The GL Series tracker is ONLY 1" (1 inch) THICK. The tracker is small enough to HIDE IN ALMOST ANYTHING, including glove boxes, bags, suitcases, and briefcases.	0607ZL6KNXB	A-SL-SOSBLK-Var	99.99	0	2022-06-07 11:00:12 PDT		y	3			11				B0B3FQD62X						850021014735			0	DEFAULT	Migrated Template	Inactive
