item-name	item-description	listing-id	seller-sku	price	quantity	open-date	image-url	item-is-marketplace	product-id-type	zshop-shipping-fee	item-note	item-condition	zshop-category1	zshop-browse-path	zshop-storefront-feature	asin1	asin2	asin3	will-ship-internationally	expedited-shipping	zshop-boldface	product-id	bid-for-featured-placement	add-delete	pending-quantity	fulfillment-channel	merchant-shipping-group	status
Seculife GPS Tracker for Kids Real-Time Tracking Device with SOS Button & 2-Way Speakerphone - Safety Electronics for Kids, Special Needs, Autism (Black)	SAFETY & INDEPENDENCE:In today's crazy world, Seculife is your eyes & ears when you can’t be with your child. SecuLife's SIMPLE TO USE GPS tracker provides an EASY way to monitor your kids' location anytime, anywhere. Our Kids SOS GPS Tracker was designed for all children but is especially useful with kids who have autism, down syndrome, or other special needs. They can contact you with the press of a button and let you know there is a problem fast. Our Plans start at only $17 a month! ACCURATE & RELIABLE GPS TRACKING: The tracker provides CONTINUOUS ALL-DAY MONITORING with a secured IoT 5G 4G LTE cellular network. Expanded GPS TRACKING capabilities work in the USA, Canada, and Mexico with free international roaming in over 200 countries. Know immediately if your child is lost and find them ASAP! Special details include unlimited REAL-TIME TRACKING, Customizable GEOFENCE SAFETY AREAS, Detailed Location History, & More. EASY-TO-SEE & USE SOS BUTTON: The Kids GPS Tracker also features easy-to-use TWO-WAY CALLING CAPABILITIES. When there is an emergency, push and hold the SOS BUTTON, which will immediately alert the pre-set contacts. Talk to your kid or LISTEN-IN REMOTELY. Includes VOICE ASSISTIVE SPEAKERPHONE and AUTO-ANSWER to help physically impaired children answer your call. RECEIVE IN APP ALERTS: It only takes 5 minutes to activate, install, and start tracking! The Seculife app will work on any smartphone, Apple IOS, Android, or Windows. With our intuitive software you can add contacts & SET PERMISSIONS, turn on & off features, and decide what ALERTS & NOTIFICATIONS you want and how to get them (Push, Email & SMS). Then, easily use the Seculife app to MONITOR AND TRACK YOUR LOVED ONES from a phone, desktop, laptop, or tablet. SMALL & LIGHTWEIGHT: The DURABLE and SPLASH RESISTANT design enables your child to use the device without impeding their day-to-day activities. With a lanyard hole SecuLife is designed to be easily attached to clothing, hidden inside po	0422FXKX9TH	FBA-SL-24MEK-BLK	59.99		2025-04-22 12:57:17 PDT		y	3			11				B0F5YJGJW1						850074527206				AMAZON_NA	Migrated Template	Active
SECULIFE - Kids Watch with GPS tracker | SOS Safety Alerts | Two-Way Calling & Texting | Kids Tracking Watch | School Mode | No Social Media | Smart Watch | Advance Parental Controls	The SecuLife Kids Smart Watch is the ultimate GPS tracker & safety tool for parents. Designed for safety-first communication, this 4G smartwatch features real-time location tracking, SOS emergency alerts, and two-way calling & texting. With No Social Media, it ensures kids stay focused and safe. It includes a School Mode and Parental controls allow guardians to monitor usage and keep their child secure at all times.	1101BIFJA15	FBA-SL-24MEK-BLU	59.99		2024-11-01 12:34:05 PDT		y	1			11				B0DLLNXR9L						B0DLLNXR9L				AMAZON_NA	Migrated Template	Active
SecuLife GPS Tracker for Elderly with Fall Detection – Medical Alert System for Seniors with 24/7 Monitoring, Caregiver App, Lightweight, SOS Panic Button & Assistive Speakerphone for Personal Safety	SecuLife provides a reliable, all-in-one safety solution for families seeking peace of mind. This fall alert watch for seniors features fall detection, real-time GPS tracking, and instant communication, functioning as a medical alert necklace for seniors, GPS tracker for elderly, and emergency alert system in one device. Comfortable and easy to wear, this lightweight, discreet medical alert necklace for women and men can be worn around the neck, clipped to clothing, or placed in a pocket. With a simple push of the emergency button for elderly, users can reach caregivers through a built-in speaker, no phone numbers to remember. This alert button that calls cell phones connects directly to caregivers or emergency contacts. Compatible with the SecuLife caregiver app, this device helps families stay informed through geofence zones and location alerts. Whether at home or on the move, the GPS watch for elderly offers accurate tracking and customizable notifications when a loved one enters or exits defined areas. No installation is required, SecuLife arrives ready to use with a pre-installed 4G LTE SIM and operates on secure, U.S.-based servers with coverage across the U.S., Mexico, and Canada. A monthly subscription is required to access features like GPS, voice calling, and emergency support services. Ideal for those seeking a medical alert necklace, fall alert bracelet, or reliable senior tracking solution, this device is a trusted choice for older adults, those prone to wandering, and individuals with memory-related conditions.It's a dependable and practical safety tool designed for real-life emergencies.	0920ZGS7EWB	FBA-SL-EV04-BLK	59		2022-09-20 14:59:32 PDT		y	1			11				B0BFZQKB2V						B0BFZQKB2V				AMAZON_NA	Migrated Template	Active
Seculife SecuLife SOS - Medical Systems for Seniors, Fall Detection for Seniors with Life Saving SOS Button, Speakerphone, Real-Time 4G LTE GPS Tracker, Ideal for Dementia & Alzheimer Care	Are you looking for an SOS GPS tracker that lets you monitor your loved ones around the clock? If so, you are in the perfect place. Seculife's tracker is specifically designed to track people with medical conditions such as Parkinson, Memory Loss, Dementia, Alzheimer & Autism.	0920ZGQUQOZ	FBA-SL-EV04-WHT	59		2022-09-20 14:20:20 PDT		y	1			11				B0BG12R3Y3						B0BG12R3Y3				AMAZON_NA	Migrated Template	Active
Seculife Seculife GPS Tracker for Kids - SecuLife Real-Time Tracking Device with SOS Button & 2-Way Speakerphone - Safety Electronics for Kids, Special Needs, Autism, Down Syndrome | Amazon USA	Keep your child safe with the SecuLife Kids GPS Tracker. This real-time location tracking device offers instant updates to parents, ensuring peace of mind at all times. The SOS button allows children to alert guardians in emergencies, while the two-way calling feature ensures immediate communication. Designed for all children, recommended for kids with autism, Down syndrome, and special needs, this device provides reliable security for families. Compact, lightweight, and easy to carry, it seamlessly integrates into daily life.	0322ABF7YX1	FBA-SL-EV04KIDS-BLK	60		2023-03-22 08:54:52 PDT		y	1			11				B0BGJHL6V3						B0BGJHL6V3				AMAZON_NA	Migrated Template	Active
Elderly Safety 4G Medical Alert System - Fall Detection, GPS Location, Assistive Speakerphone, Wearable SOS Panic Button, 24/7 Monitoring Mobile Caregiver App, Small, Lightweight, Personal Safety	SecuLife Elderly SOS GPS Tracker for Seniors with SOS Button Speakerphone, Real time for Tracking and Geofencing feature.	0129F80YD9G	FBA-SL-EV7SNRS-BLK	139		2025-01-28 16:21:14 PST		y	1			11				B0DVBWHNZT						B0DVBWHNZT				AMAZON_NA	Migrated Template	Active
Seculife Seculife Mini GPS Tracker for Vehicles Cars Trucks RVs USA Based Company. Real Time 5G 4G LTE Car GPS Tracking Device Long Lasting Battery. Worldwide Unlimited Distance. Subscription Needed		0404BCT6XN7	FBA-SL-JM-TRLL1AS	31		2024-04-03 17:13:12 PDT		y	1			11				B0CZSJBNL5						B0CZSJBNL5				AMAZON_NA	Migrated Template	Active
Seculife GPS Tracker for Kids Real-Time Tracking Device with SOS Button & 2-Way Speakerphone - Safety Electronics for Kids, Special Needs, Autism (Blue Smartwatch)	SAFETY & INDEPENDENCE:In today's crazy world, Seculife is your eyes & ears when you can’t be with your child. SecuLife's SIMPLE TO USE GPS tracker provides an EASY way to monitor your kids' location anytime, anywhere. Our Kids SOS GPS Tracker was designed for all children but is especially useful with kids who have autism, down syndrome, or other special needs. They can contact you with the press of a button and let you know there is a problem fast. Our Plans start at only $17 a month! ACCURATE & RELIABLE GPS TRACKING: The tracker provides CONTINUOUS ALL-DAY MONITORING with a secured IoT 5G 4G LTE cellular network. Expanded GPS TRACKING capabilities work in the USA, Canada, and Mexico with free international roaming in over 200 countries. Know immediately if your child is lost and find them ASAP! Special details include unlimited REAL-TIME TRACKING, Customizable GEOFENCE SAFETY AREAS, Detailed Location History, & More. EASY-TO-SEE & USE SOS BUTTON: The Kids GPS Tracker also features easy-to-use TWO-WAY CALLING CAPABILITIES. When there is an emergency, push and hold the SOS BUTTON, which will immediately alert the pre-set contacts. Talk to your kid or LISTEN-IN REMOTELY. Includes VOICE ASSISTIVE SPEAKERPHONE and AUTO-ANSWER to help physically impaired children answer your call. RECEIVE IN APP ALERTS: It only takes 5 minutes to activate, install, and start tracking! The Seculife app will work on any smartphone, Apple IOS, Android, or Windows. With our intuitive software you can add contacts & SET PERMISSIONS, turn on & off features, and decide what ALERTS & NOTIFICATIONS you want and how to get them (Push, Email & SMS). Then, easily use the Seculife app to MONITOR AND TRACK YOUR LOVED ONES from a phone, desktop, laptop, or tablet. SMALL & LIGHTWEIGHT: The DURABLE and SPLASH RESISTANT design enables your child to use the device without impeding their day-to-day activities. With a lanyard hole SecuLife is designed to be easily attached to clothing, hidden inside po	1007BKKU7EZ	FBA-SL-KDBLU25	59.99		2024-10-07 13:35:42 PDT		y	1			11				B0DJL4ZZDQ						B0DJL4ZZDQ				AMAZON_NA	Migrated Template	Active
Seculife SOS Wristband – Elderly Life Saving Fall Alert System, Emergency Call Button, Assistive Speakerphone, GPS Tracking, Seniors Dementia, Alzheimer’s, 24/7 Medical Monitoring (Black)	The SecuLife SOS Wristband is the ultimate safety solution for families looking to protect their loved ones with special needs. Whether they have autism, Parkinson’s, Alzheimer’s, dementia, or other conditions, this easy-to-use wristband offers peace of mind through real-time monitoring and emergency support. Stay connected anytime, anywhere with reliable GPS tracking powered by a secure IoT 5G/4G LTE network. Monitor location, set up custom geofences, and access detailed location history — all through the SecuLife mobile app, available on iOS, Android, and Windows. In case of emergency, a simple press of the SOS button instantly alerts designated contacts with real-time GPS information. With built-in two-way calling, loved ones can communicate directly through a voice-assistive speakerphone with auto-answer features — ideal for individuals who may have trouble using a phone. Subscription Required: Just like a cellphone, the wristband requires an active voice, SMS, and data plan. Choose from: $25/month with an initial 3-month prepayment on a yearly contract, or $15/month prepaid annually at $180. Service activation is required and is managed directly through SecuLife. Important: SecuLife devices are only compatible with SecuLife’s service plans and operate within the contiguous United States. Coverage in Canada, Mexico, and international areas is available upon request. With a 5-minute setup, user-friendly features, and powerful safety tools, the SecuLife SOS Wristband is a smart and caring way to protect the ones who matter most.	0422FXU3U3F	FBA-SL-SNRS-SWBLK	45		2025-04-22 15:38:05 PDT		y	3			11				B0F5YS19J3						850074527190				AMAZON_NA	Migrated Template	Active
SOS Smartwatch for Seniors - Gps Bracelet for Elderly Health Monitoring Medical Alert Systems for Seniors with Speaker, Medical Alert System,GPS Tracker 5G 4G LTE Cellular Service, Life Alert Necklace	<b>Empowering Safety Solutions for Adults, Seniors, and Individuals with Special Needs.</b> <br><br>In critical moments, relying solely on a cellphone or landline might not suffice for ensuring safety and security. Accessing a phone during an emergency can be extremely challenging. However, with the SecuLife SOS Smartwatch's advanced features including two-way calling and automatic SOS dialing, help can be summoned swiftly! Equipped with a pre-installed 4G LTE sim card, this smartwatch offers top-notch call clarity, precise location tracking, and rapid response times. It allows you to instantly communicate with your loved ones, even if they are unable to answer the call. The integrated speaker and microphone facilitate seamless two-way communication in case of emergencies. <br><br>Download our EASY-TO-USE App for Access to All Essential Features: Real-Time Tracking, Historical GPS Locations, Unlimited Geofencing Areas. Customizable Notifications Mobile Push Notifications Delivered to Your Mobile App, Email, and SMS/Text. <br><br>Battery Life: Up to 12 hours battery life when set to 1 minute tracking intervals. <br><br>Support Available 7-Days a Week: Operators are available via phone, chat, and email. <br><br>Free Upgrades: New and Free Equipment Provided When you Need to Upgrade. <br><br>Your Satisfaction Is Important: We want you to be delighted with your purchase so we allow a 7 day return window. An activated plan is required to use the device, and plans can be reimbursed within the 7 day period after activation. Returns will not apply for plans that have been activated for more than 7 days.	0321FAUUPYH	FBA-SL-SOS-SWSr	54.99		2025-03-21 12:57:20 PDT		y	1			11				B0CLMDVZR3						B0CLMDVZR3				AMAZON_NA	Migrated Template	Active
Seculife SOS Wristband Medical Alert System for Seniors – Emergency Fall Alert Device for Elderly, Real-Time GPS, SOS Button & Assistive Speakerphone – Ideal for Alzheimer’s, Dementia & Elderly Safety	SecuLife SOS Wristband is a powerful medical alert system GPS solution designed to help seniors maintain independence while ensuring protection. Ideal for Alzheimer’s, dementia this GPS bracelet for elderly gives caregivers peace of mind by offering real-time monitoring. Its emergency SOS button instantly alerts emergency contacts when help is needed. With real-time GPS tracking, this GPS wristband tracker for adults ensures you can always locate your loved one, especially those prone to wandering. It's a reliable tracking bracelet for adults that helps families stay connected and informed. The device also includes fall detection devices that automatically alert caregivers during a fall, making it essential for seniors with limited mobility. The fall detector for seniors feature provides added assurance and quick response. This lightweight and water-resistant personal tracker for elderly is perfect for everyday use. Designed for comfort, it functions as a discreet yet effective senior alert device with fall detection, ensuring round-the-clock safety. Its sleek design makes it a preferred choice among medical alert devices for seniors. The device pairs with the SecuLife app, compatible with iOS, Android, and Windows. Caregivers can view location history, set geofences, and receive alerts if a wearer exits a safe zone. The app enhances functionality for managing loved ones with memory-related conditions. Two-way calling enables seniors to communicate directly with caregivers, acting as both a GPS watch for elderly and an emergency tool. Whether you're looking for fall alert devices, a medical fall alert, or a dependable alert wristband for seniors, the SecuLife SOS wristband offers complete safety and convenience in one smart solution.	1102ZANPGS6	FBA-SL-SOSRED-T	45		2022-11-02 12:07:15 PDT		y	1			11				B0BL9PY6CJ						B0BL9PY6CJ				AMAZON_NA	Migrated Template	Active
Seculife Seculife SOS Wristband – Elderly Life Saving Fall Alert System, Emergency Call Button, Assistive Speakerphone, GPS Tracking, Seniors Dementia, Alzheimer’s, 24/7 Medical Monitoring		0617Z621XIB	FBA-SL-SOSWB-BLK	45		2022-06-17 09:30:55 PDT		y	1			11				B09XBTMJMT						B09XBTMJMT				AMAZON_NA	Migrated Template	Active
Seculife Seculife SOS Wristband – Elderly Life Saving Fall Alert System, Emergency Call Button, Assistive Speakerphone, GPS Tracking, Seniors Dementia, Alzheimer’s, 24/7 Medical Monitoring	For caregivers, our trackr gps is a reliable companion for elderly family members. This best elderly tracking device features a user-friendly interface and an SOS button that can be activated in case of emergencies, ensuring that help is just a press away. This feature in elderly tracking device is particularly valuable for individuals with memory issues or those prone to wandering so gps watch for elderly is best. Our tracker for elderly with dementia provides accurate, real-time location updates, allowing you to monitor your loved one’s whereabouts at any moment. Whether they are at home, running errands, or enjoying a walk, you can ensure their safety by tracking devices for seniors with just a glance at your smartphone or computer.	0617Z5ZIB9N	FBA-SL-SOSWB-Gen	45		2022-06-17 09:29:01 PDT		y	3			11				B09XBTMJMT						850021014520				AMAZON_NA	Migrated Template	Active
SecuLife GPS Tracker for Vehicles, Kids, Adults, Pets & Bikes – Hidden Car Tracker with Geo-Fencing, Location History, Water-Resistant, Lightweight Build, Long Battery Life & 4G LTE Real-Time Tracking	Compact and discreet tracker device for vehicles is perfect safety solution for families, caregivers, and pet owners. Whether you need a tracker for kids or a mini GPS tracker for vehicles, this all-in-one device delivers real-time tracking, geofencing, and emergency alerts. It’s ideal as a tracking device for kids, featuring an SOS button and reliable coverage for peace of mind. Keep your loved ones safe with this lightweight car GPS tracker. Designed for flexibility, serves as a dependable kids tracker, efficient kid tracker, and accurate kids tracking device. It also functions as a secure GPS car tracker device hidden or GPS tracker for car, helping monitor vehicles with ease. Attach this durable kids GPS tracker to backpacks, collars, or belts. It works great as a car tracking device with precise alerts and extended battery life. Use it confidently as a location tracker or stealthy tracker device, perfect for discreet use. As a tracker for car, it supports both personal and professional needs. With the kid tracker device, parents can monitor movement safely, while the tracking device for cars helps prevent loss or theft. If you're looking for hidden GPS tracking devices, this unit fits in pockets, glove boxes, or bags without drawing attention. The compact form also makes it a great kids tracker device, reliable GPS kid tracker, and trusted small GPS tracker. Ideal option as a GPS tracker for elderly, offering reassurance for families. Ideal for use among trackers for vehicles or as part of your trackers for kids collection. Also works as a vehicle GPS tracker, powerful vehicle tracking device, or hidden GPS tracking devices for cars hidden. It doubles as a child GPS tracker, stylish GPS tracker necklace, and trusted GPS tracking device for cars or location tracker for kids also great for outdoor use & can be used as a hiking companion, gear locator, or travel tracker. Easily monitor in real time via the SecuLife mobile app or any web browser.	0506BXPDTQG	FBA-SL-TRS11	30		2024-05-06 10:39:32 PDT		y	1			11				B0D2RZVND3						B0D2RZVND3				AMAZON_NA	Migrated Template	Active
SECULIFE - Kids Watch with GPS tracker | SOS Safety Alerts | Two-Way Calling & Texting | Kids Tracking Watch | School Mode | No Social Media | Smart Watch | Advance Parental Controls	SecuLife smartwatch is equipped with Google Maps that offers parents with precise real-time tracking and historical route review. Parents can feel at ease with our GPS Location Tracking kid's watches, along with the ability to make SOS calls to family and caregivers listed in the app. Parents will receive alerts when these emergency calls are made with location updates, plus the ability to block unknown calls.	1031BFS6MCF	A-SL-24MEK-BLU	59.99	0	2024-10-31 14:31:20 PDT		y	3			11				B0DLLNXR9L						850069694081			0	DEFAULT	Migrated Template	Inactive
SECULIFE - Kids Watch with GPS tracker | SOS Safety Alerts | Two-Way Calling & Texting | Kids Tracking Watch | School Mode | No Social Media | Smart Watch | Advance Parental Controls	SecuLife smartwatch is equipped with Google Maps that offers parents with precise real-time tracking and historical route review. Parents can feel at ease with our GPS Location Tracking kid's watches, along with the ability to make SOS calls to family and caregivers listed in the app. Parents will receive alerts when these emergency calls are made with location updates, plus the ability to block unknown calls.	1030BCF9BBK	A-SL-24MEK-PNK	59.99	0	2024-10-30 13:46:14 PDT		y	3			11				B0DLHSLHGX						850069694074			0	DEFAULT	Migrated Template	Inactive
SecuLife GPS Tracker for Kids | Real-Time Location, SOS Button & 2-Way Speakerphone | Safety Tracker for Kids, Parental Control App, Child Monitoring, Safe Zones	Providing Safety & Peace of Mind SecuLife provides your child with an exceptional level of safety and independence. The reliable features ensure your peace of mind while greatly enhancing quality of life. If you seek round-the-clock, uninterrupted protection, SecuLife is the perfect safety solution for parents and kids.	0522FD2JAH5	A-SL-BLKidsS4	60	0	2025-05-22 10:01:10 PDT		y	3			11				B0F9LNWZRR						850074527305			0	DEFAULT	Migrated Template	Inactive
Seculife 2025 Model Smart Watch for Kids | Phone Watch & GPS Tracker for Children Ages 5-12 | Calling, Texting, GPS Tracking, Camera, School Mode | SOS & Safety Alerts | SIM Card Included	<p>Stay Connected, Stay Safe </p><p>&nbsp; </p><p>·&nbsp;&nbsp;&nbsp;&nbsp;&nbsp;&nbsp;&nbsp;&nbsp;&nbsp; VOICE & VIDEO CALLS: Seculife &nbsp;Smart Watch is a standalone 4G/LTE kids' cellular smartwatch, that enables voice and video calls over WiFi or data. Stay in touch anytime, anywhere with HD video calling, talk-to-text, voice messages, photos, emojis, GIFs, group chats, and add friends.</p><p>·&nbsp;&nbsp;&nbsp;&nbsp;&nbsp;&nbsp;&nbsp;&nbsp;&nbsp; PRECISE LOCATION TRACKING: Seculife smartwatch for kids is equipped with Google Maps that offers parents with precise real-time tracking and historical route review. Parents can feel at ease with our GPS Location Tracking kid's watches, along with the ability to make SOS calls to family and caregivers listed in the app. Parents will receive alerts when these emergency calls are made with location updates, plus the ability to block unknown calls & texts.</p><p>·&nbsp;&nbsp;&nbsp;&nbsp;&nbsp;&nbsp;&nbsp;&nbsp;&nbsp; ENHANCED DURABILITY: Featuring IP67 water-resistant, shockproof, and dustproof capabilities, it withstands rough play. Seculife unique design enhances impact resistance, significantly reducing the screen damage risk and meeting childhood adventure demands. Equipped with long lasting battery life, 5MP Camera, secure messaging, and activity tracking.</p><p>·&nbsp;&nbsp;&nbsp;&nbsp;&nbsp;&nbsp;&nbsp;&nbsp;&nbsp; WELLNESS & FOCUS: Seculife smartwatch for kids fosters a healthy, active lifestyle with customized activity tracking,</p><p>·&nbsp;&nbsp;&nbsp;&nbsp;&nbsp;&nbsp;&nbsp;&nbsp;&nbsp; NETWORK CONNECTIVITY: At Seculife we want to offer you the best connectivity possible for your watch. Activate in minutes with no activation fee, the best compatibility with your watch, a secure nationwide 4G network, subscription plan.</p><p>&nbsp; </p><p>What’s in the Box: </p><p>·&nbsp;&nbsp;&nbsp;&nbsp;&nbsp;&nbsp;&nbsp;&nbsp;&nbsp; Seculife Smartwatch</p><p>·&nbsp;&nbsp;&nbsp;&nbsp;&nbsp;&nbsp;&nbsp;&nbsp;&nbsp; Magnetic USB Charging Cable</p><p>&nbsp;</p><p>Device Specifications: </p><p>·&nbsp;&nbsp;&nbsp;&nbsp;&nbsp;&nbsp;&nbsp;&nbsp;&nbsp; Network: &nbsp;4G LTE</p><p>·&nbsp;&nbsp;&nbsp;&nbsp;&nbsp;&nbsp;&nbsp;&nbsp;&nbsp; Splash Resistant: &nbsp;Rated IP67</p><p>·&nbsp;&nbsp;&nbsp;&nbsp;&nbsp;&nbsp;&nbsp;&nbsp;&nbsp; Charging Port: &nbsp;Magnetic charging connector with USB magnetic charging cable</p><p>·&nbsp;&nbsp;&nbsp;&nbsp;&nbsp;&nbsp;&nbsp;&nbsp;&nbsp; Battery Capacity: &nbsp;800mAh</p><p>·&nbsp;&nbsp;&nbsp;&nbsp;&nbsp;&nbsp;&nbsp;&nbsp;&nbsp; Standby Time: &nbsp;24 Hours</p><p>·&nbsp;&nbsp;&nbsp;&nbsp;&nbsp;&nbsp;&nbsp;&nbsp;&nbsp; Power On/Off: &nbsp;Push the power button on the side of the watch case</p><p>·&nbsp;&nbsp;&nbsp;&nbsp;&nbsp;&nbsp;&nbsp;&nbsp;&nbsp; Activate SOS: &nbsp;Press and hold the power button</p><p>·&nbsp;&nbsp;&nbsp;&nbsp;&nbsp;&nbsp;&nbsp;&nbsp;&nbsp; Supported Mobile App: &nbsp;Android, iOS</p>	1006BGQTXUS	A-SL-EK24MM-PNK	59.99	0	2024-10-05 17:15:14 PDT		y	3			11				B0DFZ6P1WY						860012126835			0	DEFAULT	Migrated Template	Inactive
